{
  "meta": {
    "schemaVersion": 3,
    "version": "sample-2026-09-01",
    "generatedAt": "2026-09-01T23:49:00Z",
    "currentEra": "Classic",
    "sample": true,
    "note": "Development seed data for EQLWiki - Eye of Zomm. Official releases should bundle the GitHub-mirrored production dataset."
  },
  "zones": [
    {
      "name": "Ak'Anon",
      "viewerName": "Ak'Anon",
      "wikiTitle": "Ak'Anon",
      "aliases": [
        "akanon"
      ]
    },
    {
      "name": "Plane of Sky",
      "viewerName": "Plane of Sky",
      "wikiTitle": "The Plane of Sky",
      "aliases": [
        "airplane",
        "sky",
        "The Plane of Sky"
      ]
    },
    {
      "name": "The Arena",
      "viewerName": "The Arena",
      "wikiTitle": "The Arena",
      "aliases": [
        "arena"
      ]
    },
    {
      "name": "Befallen",
      "viewerName": "Befallen",
      "wikiTitle": "Befallen",
      "aliases": [
        "befallen"
      ]
    },
    {
      "name": "Gorge of King Xorbb",
      "viewerName": "Gorge of King Xorbb",
      "wikiTitle": "Gorge of King Xorbb",
      "aliases": [
        "beholder"
      ]
    },
    {
      "name": "Blackburrow",
      "viewerName": "Blackburrow",
      "wikiTitle": "Blackburrow",
      "aliases": [
        "blackburrow"
      ]
    },
    {
      "name": "Butcherblock Mountains",
      "viewerName": "Butcherblock Mountains",
      "wikiTitle": "Butcherblock Mountains",
      "aliases": [
        "butcher"
      ]
    },
    {
      "name": "Dagnor's Cauldron",
      "viewerName": "Dagnor's Cauldron",
      "wikiTitle": "Dagnor's Cauldron",
      "aliases": [
        "cauldron"
      ]
    },
    {
      "name": "Cazic Thule",
      "viewerName": "Cazic Thule",
      "wikiTitle": "Cazic Thule",
      "aliases": [
        "cazicthule"
      ]
    },
    {
      "name": "West Commonlands",
      "viewerName": "West Commonlands",
      "wikiTitle": "West Commonlands",
      "aliases": [
        "commons"
      ]
    },
    {
      "name": "Crushbone",
      "viewerName": "Crushbone",
      "wikiTitle": "Crushbone",
      "aliases": [
        "crushbone"
      ]
    },
    {
      "name": "East Commonlands",
      "viewerName": "East Commonlands",
      "wikiTitle": "East Commonlands",
      "aliases": [
        "ecommons"
      ]
    },
    {
      "name": "Erudin",
      "viewerName": "Erudin",
      "wikiTitle": "Erudin",
      "aliases": [
        "erudnext"
      ]
    },
    {
      "name": "Erudin Palace",
      "viewerName": "Erudin Palace",
      "wikiTitle": "Erudin Palace",
      "aliases": [
        "erudnint"
      ]
    },
    {
      "name": "Erud's Crossing",
      "viewerName": "Erud's Crossing",
      "wikiTitle": "Erud's Crossing",
      "aliases": [
        "erudsxing"
      ]
    },
    {
      "name": "Everfrost Peaks",
      "viewerName": "Everfrost Peaks",
      "wikiTitle": "Everfrost Peaks",
      "aliases": [
        "everfrost"
      ]
    },
    {
      "name": "Plane of Fear",
      "viewerName": "Plane of Fear",
      "wikiTitle": "Plane of Fear",
      "aliases": [
        "fearplane"
      ]
    },
    {
      "name": "The Feerrott",
      "viewerName": "The Feerrott",
      "wikiTitle": "The Feerrott",
      "aliases": [
        "feerrott"
      ]
    },
    {
      "name": "Northern Felwithe",
      "viewerName": "Northern Felwithe",
      "wikiTitle": "Northern Felwithe",
      "aliases": [
        "felwithea"
      ]
    },
    {
      "name": "Southern Felwithe",
      "viewerName": "Southern Felwithe",
      "wikiTitle": "Southern Felwithe",
      "aliases": [
        "felwitheb"
      ]
    },
    {
      "name": "East Freeport",
      "viewerName": "East Freeport",
      "wikiTitle": "East Freeport",
      "aliases": [
        "freporte"
      ]
    },
    {
      "name": "North Freeport",
      "viewerName": "North Freeport",
      "wikiTitle": "North Freeport",
      "aliases": [
        "freportn"
      ]
    },
    {
      "name": "West Freeport",
      "viewerName": "West Freeport",
      "wikiTitle": "West Freeport",
      "aliases": [
        "freportw"
      ]
    },
    {
      "name": "Greater Faydark / Kelethin",
      "viewerName": "Greater Faydark / Kelethin",
      "wikiTitle": "Greater Faydark / Kelethin",
      "aliases": [
        "gfaydark",
        "Greater Faydark",
        "Kelethin"
      ]
    },
    {
      "name": "Grobb",
      "viewerName": "Grobb",
      "wikiTitle": "Grobb",
      "aliases": [
        "grobb"
      ]
    },
    {
      "name": "Lower Guk",
      "viewerName": "Lower Guk",
      "wikiTitle": "Lower Guk",
      "aliases": [
        "gukbottom"
      ]
    },
    {
      "name": "Upper Guk",
      "viewerName": "Upper Guk",
      "wikiTitle": "Upper Guk",
      "aliases": [
        "guktop"
      ]
    },
    {
      "name": "Halas",
      "viewerName": "Halas",
      "wikiTitle": "Halas",
      "aliases": [
        "halas"
      ]
    },
    {
      "name": "Plane of Hate",
      "viewerName": "Plane of Hate",
      "wikiTitle": "Plane of Hate",
      "aliases": [
        "hateplane"
      ]
    },
    {
      "name": "High Keep",
      "viewerName": "High Keep",
      "wikiTitle": "High Keep",
      "aliases": [
        "highkeep"
      ]
    },
    {
      "name": "Highpass Hold",
      "viewerName": "Highpass Hold",
      "wikiTitle": "Highpass Hold",
      "aliases": [
        "highpass"
      ]
    },
    {
      "name": "The Hole",
      "viewerName": "The Hole",
      "wikiTitle": "The Hole",
      "aliases": [
        "hole"
      ]
    },
    {
      "name": "Innothule Swamp",
      "viewerName": "Innothule Swamp",
      "wikiTitle": "Innothule Swamp",
      "aliases": [
        "innothule"
      ]
    },
    {
      "name": "East Karana",
      "viewerName": "East Karana",
      "wikiTitle": "East Karana",
      "aliases": [
        "eastkarana"
      ]
    },
    {
      "name": "South Kaladim",
      "viewerName": "South Kaladim",
      "wikiTitle": "South Kaladim",
      "aliases": [
        "kaladima"
      ]
    },
    {
      "name": "North Kaladim",
      "viewerName": "North Kaladim",
      "wikiTitle": "North Kaladim",
      "aliases": [
        "kaladimb"
      ]
    },
    {
      "name": "Kedge Keep",
      "viewerName": "Kedge Keep",
      "wikiTitle": "Kedge Keep",
      "aliases": [
        "kedge"
      ]
    },
    {
      "name": "Kerra Island",
      "viewerName": "Kerra Island",
      "wikiTitle": "Kerra Island",
      "aliases": [
        "kerra"
      ]
    },
    {
      "name": "Jaggedpine Forest",
      "viewerName": "Jaggedpine Forest",
      "wikiTitle": "Jaggedpine Forest",
      "aliases": [
        "jaggedpine"
      ]
    },
    {
      "name": "Kithicor Forest",
      "viewerName": "Kithicor Forest",
      "wikiTitle": "Kithicor Forest",
      "aliases": [
        "kithicor"
      ]
    },
    {
      "name": "Lake Rathetear",
      "viewerName": "Lake Rathetear",
      "wikiTitle": "Lake Rathetear",
      "aliases": [
        "lakerathe"
      ]
    },
    {
      "name": "Lavastorm Mountains",
      "viewerName": "Lavastorm Mountains",
      "wikiTitle": "Lavastorm Mountains",
      "aliases": [
        "lavastorm"
      ]
    },
    {
      "name": "Lesser Faydark",
      "viewerName": "Lesser Faydark",
      "wikiTitle": "Lesser Faydark",
      "aliases": [
        "lfaydark"
      ]
    },
    {
      "name": "Mistmoore Castle",
      "viewerName": "Mistmoore Castle",
      "wikiTitle": "Mistmoore Castle",
      "aliases": [
        "mistmoore"
      ]
    },
    {
      "name": "Misty Thicket",
      "viewerName": "Misty Thicket",
      "wikiTitle": "Misty Thicket",
      "aliases": [
        "misty"
      ]
    },
    {
      "name": "Najena",
      "viewerName": "Najena",
      "wikiTitle": "Najena",
      "aliases": [
        "najena"
      ]
    },
    {
      "name": "Nektulos Forest",
      "viewerName": "Nektulos Forest",
      "wikiTitle": "Nektulos Forest",
      "aliases": [
        "nektulos"
      ]
    },
    {
      "name": "Neriak - Foreign Quarter",
      "viewerName": "Neriak - Foreign Quarter",
      "wikiTitle": "Neriak - Foreign Quarter",
      "aliases": [
        "neriaka"
      ]
    },
    {
      "name": "Neriak - Commons",
      "viewerName": "Neriak - Commons",
      "wikiTitle": "Neriak - Commons",
      "aliases": [
        "neriakb"
      ]
    },
    {
      "name": "Neriak - Third Gate",
      "viewerName": "Neriak - Third Gate",
      "wikiTitle": "Neriak - Third Gate",
      "aliases": [
        "neriakc"
      ]
    },
    {
      "name": "North Karana",
      "viewerName": "North Karana",
      "wikiTitle": "North Karana",
      "aliases": [
        "northkarana"
      ]
    },
    {
      "name": "North Ro",
      "viewerName": "North Ro",
      "wikiTitle": "The Northern Desert of Ro",
      "aliases": [
        "nro",
        "northro",
        "The Northern Desert of Ro",
        "Northern Desert of Ro"
      ]
    },
    {
      "name": "Oasis of Marr",
      "viewerName": "Oasis of Marr",
      "wikiTitle": "The Oasis of Marr",
      "aliases": [
        "oasis",
        "The Oasis of Marr"
      ]
    },
    {
      "name": "Oggok",
      "viewerName": "Oggok",
      "wikiTitle": "Oggok",
      "aliases": [
        "oggok"
      ]
    },
    {
      "name": "Ocean of Tears",
      "viewerName": "Ocean of Tears",
      "wikiTitle": "Ocean of Tears",
      "aliases": [
        "oot"
      ]
    },
    {
      "name": "Paineel",
      "viewerName": "Paineel",
      "wikiTitle": "Paineel",
      "aliases": [
        "paineel"
      ]
    },
    {
      "name": "Splitpaw Lair",
      "viewerName": "Splitpaw Lair",
      "wikiTitle": "Splitpaw Lair",
      "aliases": [
        "paw"
      ]
    },
    {
      "name": "Permafrost",
      "viewerName": "Permafrost",
      "wikiTitle": "Permafrost",
      "aliases": [
        "permafrost"
      ]
    },
    {
      "name": "Qeynos Aqueducts",